{"schemaVersion":"1.0.0","artifactPrefix":"stratton","generatedAt":"2026-08-03T03:29:57.5348202Z","phase":5,"candidateStatus":"READY_FOR_ASSURANCE","deploymentReady":false,"upstream":{"phase4ManifestSha256":"87ff470043fce913e6dd3e2121430072552443ae5cacaaa1454cb8396a9265c4","phase4ApprovalId":"STRATTON-PHASE-4-APPROVAL-001","modelPlanRevision":15,"phase5ModelPlan":{"path":"0-coordination/stratton-model-plan-revision-15.json","sha256":"7ce3ff77d47384ceaf3e0515b3350578831b5a2fedfcbeba4e586399dc9f6fb4"}},"source":{"commit":"8d4f42b19226729bd1e3fb68e5a353b554b4b3a1","commitScope":"FRAMEWORK_REPOSITORY_ANCHOR_ONLY_CASE_PACKAGE_HASHED_SEPARATELY","worktreeTracked":false,"worktreeDirty":true,"worktreeStatus":["!! ../"]},"environments":["dev","tst","prd"],"deploymentUnits":["DU-01","DU-02","DU-03","DU-04","DU-05","DU-06","DU-07","DU-08","DU-09","DU-10","DU-11","DU-12","DU-13","DU-14","DU-15","DU-16","DU-17"],"validation":{"status":"PASS","runId":"20260803T031539999Z","evidence":"evidence/local-validation/20260803T031539999Z/index.json","evidenceBoundary":{"localValidationReleaseStep":"RELEASE_MANIFEST_ONLY","finalFreezeOutsideValidationRun":true,"freezeSequence":["validation/New-BuildReport.ps1","validation/New-Phase5Hashes.ps1","validation/Test-ReleaseEvidence.ps1"]}},"images":[{"name":"api","digest":"sha256:3d1bc500907cb6ad3c8384f775dd7dffcb7d1f53b6f6675b704ead6ccd936c55","platform":"linux/amd64","sbom":"evidence/containers/20260803T032858815Z/api.sbom.cdx.json","scan":"evidence/containers/20260803T032858815Z/api.trivy.json"},{"name":"worker","digest":"sha256:f23a660f3e578577924fa3799a12351ecf30d5d61485a40db13702d3349b0512","platform":"linux/amd64","sbom":"evidence/containers/20260803T032858815Z/worker.sbom.cdx.json","scan":"evidence/containers/20260803T032858815Z/worker.trivy.json"}],"signing":{"method":"ephemeral-local-cosign-key","identityBacked":false,"transparencyLogUploaded":false,"statement":"evidence/containers/20260803T032858815Z/container-digests.json","signature":"evidence/containers/20260803T032858815Z/container-digests.sig","publicKey":"evidence/containers/20260803T032858815Z/container-digests.pub","limitation":"Local integrity evidence only; an approved release identity must sign any deployable registry artifact."},"dependencyEvidence":{"avmModuleDigests":"evidence/dependency-evidence.json","toolVersions":"tooling/tool-versions.json","containerSummary":"evidence/containers/20260803T032858815Z/summary.json","baseImage":{"reference":"mcr.microsoft.com/azurelinux/base/nodejs:24@sha256:6523505968bf37b0f97975cedfd202a3dbaee44ed653d17890d36deead3828cc","indexDigest":"sha256:6523505968bf37b0f97975cedfd202a3dbaee44ed653d17890d36deead3828cc","amd64ManifestDigest":"sha256:6b54af097b07e5e128fb4ee90ba59cbeff889ccc87d1466361ec62f7b3b15286","evidence":"evidence/containers/20260803T032858815Z/node-base-index.json"},"scannerDatabase":"evidence/containers/20260803T032858815Z/trivy-db-metadata.json","sourceSecuritySummary":"evidence/source-security/20260803T032836625Z/summary.json","sourceSecurityScan":"evidence/source-security/20260803T032836625Z/trivy-source.json","sourceSecurityDatabase":"evidence/source-security/20260803T032836625Z/trivy-db-metadata.json"},"authorityChangeControl":{"changeControlId":"STRATTON-CC-001","status":"APPROVED_FOR_PHASE5_AUTHORITY_INTERFACE_FINALISATION","modelPlanRevision":"11","modelPlan":{"path":"0-coordination/stratton-model-plan-revision-11.json","sha256":"b9fe50b7de6ba21e452d09fde4c827d03d763163dfb60c8bad9d9bd273fa900a"},"approval":{"path":"approvals/change-control/stratton-cc-001-approval-1.json","sha256":"ec2ddad8bc9c38993d5266985db5c9e9f12358034ba3aad9c61cd93465d8b21d"},"subjects":[{"phaseId":"3","path":"3-azure-design/stratton-phase-3-hashes-cc-001-r2-proposed.json","sha256":"e1b344c59fb2378de07503bee7b27b8f71bb987a148dabd36d66b51830b9bf54"},{"phaseId":"4","path":"4-implementation-plan/stratton-phase-4-hashes-cc-001-r3-proposed.json","sha256":"4ecd7bd341d406f4361d8441b8c5d961848fef9506ebbd0dc8034016ee569626"}],"affAReviews":[{"phaseId":"3","round":5,"verdict":"CONFORMS-WITH-GAPS","path":"reviews/aff-a/3/round-5/stratton-aff-a-review.json","sha256":"1be8a11a1cf51e9009be9db1e9dcb2f8e5369181c1c6862b988de9d29f28d539"},{"phaseId":"4","round":6,"verdict":"CONFORMS-WITH-GAPS","path":"reviews/aff-a/4/round-6/stratton-aff-a-review.json","sha256":"e2ab8da4dbcaa8cc826ba825432129e60d2756b0e515dabaf30156eaf73627e8"}],"affBReviews":[{"phaseId":"3","round":4,"verdict":"CONFORMS-WITH-GAPS","path":"reviews/aff-b/3/round-4/stratton-aff-b-review.json","sha256":"0adf627a1e43de0553d106eb6c446a47f3b2718cf3adeafa844c7bd5944e5e9c"},{"phaseId":"4","round":3,"verdict":"CONFORMS-WITH-GAPS","path":"reviews/aff-b/4/round-3/stratton-aff-b-review.json","sha256":"b220e01bbede12f7fff81e3220c15a2271b27b4970c35bd963ee877049e3d7b9"}],"complianceCoverage":{"path":"reviews/aff-b/coverage/stratton-compliance-coverage-007.json","sha256":"e769a9326a6bf362a566a42934ef6093d2dca8e37bc955a53474e17f664147d8"}},"unresolvedControls":["VAL-001","VAL-002","VAL-003","VAL-004","VAL-005","AFFB-RES-001","AFFB-RES-002","CC1-OWN-001","CC1-OWN-002","CC1-OWN-003","CC1-OWN-004","CC1-OWN-005","CC1-OWN-006","CC1-OWN-007"],"retainedMinorGaps":["AFFB-CC001-R2-MIN-001","AFFB-CC001-R3-MIN-002"],"authorityConflicts":["Assurance verdict issuance is not deployable in DU-12","Analysis execution interface remains authority-blocked","Audit evidence export interface remains authority-blocked"],"azureExecution":{"authenticated":false,"validateExecuted":false,"whatIfExecuted":false,"deploymentExecuted":false},"canonicalization":{"hashRoot":"5-coding-r4","canonicalManifestPath":"5-coding-r4/stratton-phase-5-hashes.json","pathSeparator":"/","sort":"ordinal","encoding":"UTF-8 without BOM","trailingNewline":false,"excluded":["node_modules","dist","out","generated release outputs"]},"files":[{"path":"README.md","sha256":"bf44e38667949262b4017281921bfffc5d529f929f135baa9e00ee79c2f4be4a","sizeBytes":4570},{"path":"app/ASSURANCE-BOUNDARY-CONFLICT-NOTE.md","sha256":"6dd1ee4ef752661368f2e16fa7abec7cdfd19086b5c59223598d100f1a8aa296","sizeBytes":659},{"path":"app/Dockerfile.api","sha256":"bb7ad3293be7ca10c56f86799475d9c5a4fbd75dacd796799f3db4544353bc9e","sizeBytes":958},{"path":"app/Dockerfile.worker","sha256":"6de122f610a5c84cd12eada5d0d8a0a2357a20fbf6c557e506565ae67d27ae56","sizeBytes":961},{"path":"app/README.md","sha256":"1429de84f8e35ae8c01d4ea873e1f942a05002f206f6a985513763d805a11e3a","sizeBytes":2770},{"path":"app/authority-boundary-conflict-note.md","sha256":"571c045f3ff061284dbcd354aa7346dbf1096daa082a2cf8456bca0b11cd5ecd","sizeBytes":1374},{"path":"app/migrations/001_init.sql","sha256":"15cd7822e78dba070098a302afbfefe7a8fc4f836bf2e7a24a0cfee2a2e94ac1","sizeBytes":65051},{"path":"app/openapi/stratton-openapi-3.1.yaml","sha256":"3a97aa5b0c1cebfce69a7cbeaf1df19dc9b4d652ad1326be2eadfadc857996e9","sizeBytes":17537},{"path":"app/package-lock.json","sha256":"b90b74e8afb700b54472dee123ffbc94445c7b3fedc437ba486cb15b3d8ea8df","sizeBytes":76395},{"path":"app/package.json","sha256":"85162f6d26bceec7d61bce082fe38da06b12ca719b89c1cfe988a6180749626d","sizeBytes":1336},{"path":"app/scripts/check-docker-digest.mjs","sha256":"aa6cfb59851388e7e86f175102c1507ece0ddc9f46d8266b16c3f40bd554f906","sizeBytes":713},{"path":"app/scripts/check-format.mjs","sha256":"1515246fcefbd9fd7242d1a0e104463c4ab39b615588fa319dbc60b931c2ec28","sizeBytes":1139},{"path":"app/scripts/check-lint.mjs","sha256":"ebedc4b5abd41ec9930ec91c6a382ff9d8adc5ac45fdc6b709705e795e4182db","sizeBytes":874},{"path":"app/scripts/check-migrations.mjs","sha256":"6660e7561510fcf8bc672b72908fa8ab062fcdc3bde2d199c8d061a240972444","sizeBytes":3453},{"path":"app/scripts/check-openapi.mjs","sha256":"238354dd07c2a066aee471032cee53f76db502b030cc03f81f9c38811f3032f6","sizeBytes":3027},{"path":"app/src/admission-service.ts","sha256":"e756cb30bf178860ed36104ed392fc4bd874053cefb1efc7af32a688bc0008ee","sizeBytes":1009},{"path":"app/src/analysis-boundary.ts","sha256":"ddd2ef0682b3cc4a4fa84ed5379a0aa93c82541b1dffe15d28eaa978ffa370cb","sizeBytes":1361},{"path":"app/src/api-main.ts","sha256":"83e4479e433879ce059c9934c4423efb29186bad1b024a3ba6c914f37fd36e2e","sizeBytes":5438},{"path":"app/src/api-runtime.ts","sha256":"ed3261d658dfb1128936d0698f5f922f86c895359eb33a16dbc4b3ba3a46d615","sizeBytes":68515},{"path":"app/src/audit-outbox.ts","sha256":"85421cc0e998cf3529479c47516fe31dcbba7f7242735741035662ebaa991202","sizeBytes":1775},{"path":"app/src/benchmark-runner.ts","sha256":"fbd0c338c54a7751924db3d6817aef469d26025d3f5f853087f6203dd6017e92","sizeBytes":1640},{"path":"app/src/claim-lineage-service.ts","sha256":"8dd171596d9be1e275b3107fade702dc22058d09c7367a278486b2afb8647384","sizeBytes":1527},{"path":"app/src/config.ts","sha256":"c1d3e85ef1b65dbdc8e797130f214d432c7a111a43f68cda5e6214f4397f3cf9","sizeBytes":2668},{"path":"app/src/health.ts","sha256":"d964f408c7f67258e9607f7b1dafa22a997ca2e2a1b9df5d77cbb87fd5cd8592","sizeBytes":708},{"path":"app/src/idempotency-store.ts","sha256":"52c21e74551337b58165aa2791e90550a0ee7630c491b7b30c97be9cd0677c05","sizeBytes":15571},{"path":"app/src/index.ts","sha256":"6ffe300f02160ba33ab1b60116d61e458636e4929df70ca14e366971151fa918","sizeBytes":744},{"path":"app/src/logger.ts","sha256":"779277d7c94c970897609bcf4e1e9081cc0d520d6f886d2d5bab08f14333bae2","sizeBytes":2145},{"path":"app/src/openapi-contract.ts","sha256":"a77798514658b751d0807dacc9ed0a423613d04f472f460426edf134337445b5","sizeBytes":1978},{"path":"app/src/policy-service.ts","sha256":"5857c7ed83fb8f678809dff16ed698fdc5d09a5394794d5d7b964ade07c7352d","sizeBytes":4302},{"path":"app/src/provider-adapters.ts","sha256":"de908682b2683e448cac9df2ea0440dfc3c0144654a3a435de6fb6719dcc9c18","sizeBytes":8296},{"path":"app/src/queue-adapters.ts","sha256":"081a138a1411bdb0b07fa105a41fdae9ca5702208b4e9accf21de8a9fd72eefb","sizeBytes":8791},{"path":"app/src/queue-consumer.ts","sha256":"8108f7d4cec3f514e904b07fd77002052f8409050389b803fbddde860499a4ac","sizeBytes":9